{
  "schemaVersion": "1.0",
  "id": "reference-packaging-line",
  "name": "Reference packaging line",
  "unitOfFlow": "bottles",
  "equipment": [
    {
      "id": "blower-1",
      "type": "BLOWER",
      "name": "Blower",
      "nominalRatePerSecond": 20,
      "bufferAfterCapacity": 100,
      "initialMode": "AUTO"
    },
    {
      "id": "conveyor-1",
      "type": "CONVEYOR",
      "name": "Infeed conveyor",
      "nominalRatePerSecond": 100,
      "bufferAfterCapacity": 300,
      "initialMode": "AUTO"
    },
    {
      "id": "pacemaker-1",
      "type": "PACEMAKER",
      "name": "Pacemaker",
      "nominalRatePerSecond": 25,
      "bufferAfterCapacity": 80,
      "initialMode": "AUTO",
      "noiseProfile": {
        "microStop": {
          "probabilityPerMinute": 0.5,
          "minDurationSeconds": 20,
          "maxDurationSeconds": 20
        }
      }
    },
    {
      "id": "conveyor-2",
      "type": "CONVEYOR",
      "name": "Discharge conveyor",
      "nominalRatePerSecond": 100,
      "bufferAfterCapacity": 120,
      "initialMode": "AUTO"
    },
    {
      "id": "palletizer-1",
      "type": "PALLETIZER",
      "name": "Palletizer",
      "nominalRatePerSecond": 25,
      "bufferAfterCapacity": 0,
      "initialMode": "AUTO"
    }
  ]
}
